{
  "version": "1.0.0",
  "name": "Swarm System Test Suite",
  "description": "Comprehensive test suite for distributed system components",
  "languages": ["typescript", "python"],
  "test_types": ["unit", "integration", "e2e"],
  "global_config": {
    "environment": "test",
    "timeout": 600,
    "required_services": ["database", "network", "cache"]
  },
  "test_cases": [
    {
      "id": "550e8400-e29b-41d4-a716-446655440000",
      "name": "Swarm Job Creation Test",
      "description": "Validate swarm job creation process",
      "type": "integration",
      "language": "typescript",
      "timeout": 60,
      "dependencies": ["database", "network"]
    },
    {
      "id": "6ba7b810-9dad-11d1-80b4-00c04fd430c8",
      "name": "Node Authentication Test",
      "description": "Test node authentication mechanisms",
      "type": "security",
      "language": "python",
      "timeout": 30,
      "skip": false
    }
  ]
}