{
  "version": "1.0.0",
  "name": "CI/CD Test Suite",
  "description": "Comprehensive test configuration for CI pipeline",
  "languages": ["typescript", "python"],
  "test_types": ["unit", "integration", "e2e"],
  "global_config": {
    "environment": "test",
    "timeout": 600,
    "required_services": ["database", "cache", "api"]
  },
  "test_cases": [
    {
      "id": "550e8400-e29b-41d4-a716-446655440000",
      "name": "Node Authentication Test",
      "description": "Test node authentication mechanisms",
      "type": "unit",
      "language": "typescript",
      "timeout": 60
    },
    {
      "id": "6ba7b810-9dad-11d1-80b4-00c04fd430c8",
      "name": "API Integration Test",
      "description": "Validate API endpoint integrations",
      "type": "integration",
      "language": "python",
      "timeout": 120,
      "dependencies": ["database", "api"]
    }
  ]
}